,excercise_name,utility,mechanics,force,preparation,execution,comments,dynamic_articulation,static_articulation
20,Tapioca,[],[],[],"Stand with right side facing intended path, feet slightly apart and knees slightly bent. Begin to pull right arm back and extend left arm forward. Bend and turn right leg outward, positioning heel off ground momentarily.","['Begin to pull left arm back and extend right arm forward. Place right foot on ground so foot points outward while placing bend leg left inward in front of right leg. While lifting heel of right foot, place left foot on ground in front of right foot so both feet point to right. Begin to pull right arm back and extend left arm forward. Rotate right leg inward then hop and turn on left foot landing on forefoot with both legs together with knees and feet pointing to left. Step left foot back behind right foot. Begin to pull right arm back and extend left arm forward. Hop up from left rear foot and pull right leg back landing on forefoot while lifting left leg forward. Repeat movement pattern to desired distance or duration. If desired, repeat in the opposite direction so that the left leg leads.']","Tapioca is a lateral movement drill which can be used as warm-up drill. The movement involves shuffling sideways while rotating lower body from side with arms swinging in opposition. Keep knees bent, shoulders relaxed, and head up. Start slow and build up pace. Intensity may be increased by performing drill more quickly. Also see Grapevine or Carioca.","['Hip (Adduction)', 'Scapula (Protraction)', 'Hip (Extension)', 'Shoulder (Flexion)', 'Spine (Rotation)', 'Shoulder (Adduction)', 'Scapula (Retraction)', 'Hip (Internal Rotation)', 'Knee (Extension)', 'Ankle (Plantar Flexion)', 'Shoulder (Transverse Extension)', 'Hip (External Rotation)', 'Scapula (Downward Rotation)', 'Scapula (Upward Rotation)', 'Shoulder (Transverse Flexion)', 'Shoulder (Extension / Hyperextension)', 'Hip (Abduction)', 'Shoulder (Abduction)']","['Spine (Lateral Flexion)', 'Spine (Extension)']"
21,Jump Rope: Alternating Leg Hop,[],[],[],Grasp jump rope handles on each side. Initiate side swing mount or start with rope behind body and swing rope from behind over head.,"['Swing rope in front of body, down to floor. Hop on one leg as rope travels under foot and repeat with same foot. Alternate successive hops between opposite foot. Repeat.']","Hop heights should be minimal, just enough to clear the rope, maximize jump rope efficiency, and decrease joint impact. Intensity can be altered by increasing speed of hops.","['Hip (Extension)', 'Knee (Extension)', 'Ankle (Plantar Flexion)']","['Hip (Abduction)', 'Hip (Flexion)']"
22,Jump Rope: Boxer Step,[],[],[],Grasp jump rope handles on each side. Initiate side swing mount or start with rope behind body and swing rope from behind overhead.,"['Swing rope in front of body, down to floor. Hop up as rope travels under foot and land over to left side, left foot lands then right foot touches. Swing rope around body and hop over rope again landing to right side, right foot lands then left foot touches. Continue jumps hopping side to side.']","This movement is different from Skier Step since both feet do not make contact with ground simultaneously. Hop heights should be minimal, just enough to clear rope, maximize jump rope efficiency, and decrease joint impact. Intensity can be altered by increasing speed of hops.","['Hip (Extension)', 'Spine (Thoracic, Lumbar) (Lateral Flexion)', 'Hip (Flexion)', 'Ankle (Plantar Flexion)', 'Knee (Extension)', 'Hip (Abduction)']",[]
23,Jump Rope: Basic Hop,[],[],[],"Grasp jump rope handles on each side. Initiate side swing mount or start with rope behind body and swing rope from behind overhead. Body weight should be balanced on the balls of the feet, with knees slightly bent.","['Swing rope in front of body, down to floor. Hop as rope travels under feet, and repeat.']","Hop heights should be minimal, just enough to clear the rope, maximize jump rope efficiency, and decrease joint impact. Intensity can be altered by increasing speed of hops. Also see side view.","['Hip (Extension)', 'Knee (Extension)', 'Ankle (Plantar Flexion)']",[]
24,Jump Rope: Criss Cross,[],[],[],Grasp jump rope handles on each side. Initiate side swing mount or start with rope behind body and swing rope from behind over head.,"['As rope travels forward in front of body, cross arms downward in front of hips and jump over rope. Keep arms crossed while rope swings up behind body. As rope travels forward in front of body, uncross arms back out to sides and jump over rope and repeat.']","Hop heights should be minimal, just enough to clear rope, maximize jump rope efficiency, and decrease joint impact. Intensity can be altered by increasing speed of hops.","['Hip (Extension)', 'Shoulder (Internal Rotation)', 'Hip (Flexion)', 'Ankle (Plantar Flexion)', 'Shoulder (External Rotation)', 'Knee (Extension)']",[]
25,Jump Rope: Single Leg Criss Cross,[],[],[],Grasp jump rope handles on each side. Initiate side swing mount or start with rope behind body and swing rope from behind overhead. Stand on one foot (base foot) with other foot up off of floor.,"['As rope travels forward in front of body, cross arms downward in front of hips and jump over rope with base foot. Keep arms crossed while rope swings up behind body. As rope travels forward in front of body, uncross arms back out to sides and jump over rope with base foot and repeat.']","Change base foot periodically. Alternating base foot every swing, would be referred to as 'Jog Step Criss Cross'. Hop heights should be minimal, just enough to clear rope, maximize jump rope efficiency, and decrease joint impact. Intensity can be altered by increasing speed of hops.","['Hip (Extension)', 'Shoulder (External Rotation)', 'Knee (Extension)', 'Ankle (Plantar Flexion)', 'Shoulder (Internal Rotation)']","['Hip (Abduction)', 'Hip (Flexion)']"
26,Jump Rope: Double Under,[],[],[],Grasp jump rope handles on each side. Initiate side swing mount or start with rope behind body and swing rope from behind overhead.,['Jump and swiftly swing rope around body and under feet twice before landing. Repeat.'],Intensity can be altered by increasing speed or height of hops.,"['Hip (Extension)', 'Hip (Flexion)', 'Ankle (Plantar Flexion)', 'Knee (Flexion)', 'Knee (Extension)']",[]
27,Jump Rope: Heel Tap,[],[],[],"Grasp jump rope handles on each side. Initiate side swing mount or start with rope behind body and swing rope from behind overhead. Continue swinging rope front of body, down to floor.",[],"Heel tap may also be performed without first hop, going directly into heel tap without intermediate step. Hop heights should be minimal, just enough to clear the rope, maximize jump rope efficiency, and decrease joint impact. Intensity can be altered by increasing speed of movement.","['Hip (Extension)', 'Hip (Flexion)', 'Ankle (Plantar Flexion)', 'Knee (Extension)', 'Ankle (Dorsal Flexion)']",['Hip (Abduction)']
28,Jump Rope: Jog Step,[],[],[],"Grasp jump rope handles on each side. Initiate side swing mount or start with rope behind body and swing rope from behind overhead. Swing rope in front of body, down to floor.","['Swing rope in front of body, down to floor. Hop on one leg as rope travels under foot. Repeat by alternating legs.']","Hop heights should be minimal, just enough to clear rope, maximize jump rope efficiency, and decrease joint impact. Intensity can be altered by increasing speed of hops.","['Ankle (Plantar Flexion)', 'Hip (Extension)', 'Knee (Extension)', 'Hip (Flexion)']",['Hip (Abduction)']
29,Jump Rope: Keltic Step,[],[],[],"Grasp jump rope handles on each side. Initiate side swing mount or start with rope behind body and swing rope from behind overhead. Continue swinging rope front of body, down to floor.",[],"Hop heights should be minimal, just enough to clear the rope, maximize jump rope efficiency, and decrease joint impact. Intensity can be altered by increasing speed of movement.","['Hip (Extension)', 'Hip (Flexion)', 'Knee (Flexion)', 'Hip (Internal Rotation)', 'Knee (Extension)', 'Ankle (Plantar Flexion)', 'Hip (External Rotation)']",['Hip (Abduction)']
30,Jump Rope: Side Swing,[],[],[],Grasp jump rope handles on each side.,"['Throw rope back and under to one side. As rope travels upward from behind then throw rope downward and front of body diagonally to opposite side. Pattern can be repeated on opposite side alternating between sides.', 'Mount', 'Side swing is used to initiate adequate revolution speed before initiating jumps. Just before rope swings downward in front of body, arms can separate to each side so rope travels under feet.']",Back swing can be initiated with one hand grasping both handles. Other hand can pickup up second handle near end of downward diagonal swing. Once begun pattern is repeated by throwing higher arm over lower arm. Side Swing can also be used to dismount at end of jumps.,"['Shoulder (Flexion)', 'Spine (Rotation)', 'Shoulder Girdle (Retraction)', 'Wrist (Flexion)', 'Shoulder (External Rotation)', 'Elbows (Flexion)', 'Shoulder Girdle (Downward Rotation)', 'Wrist (Radial Deviation)', 'Shoulder Girdle (Protraction)', 'Forearm (Pronation)', 'Shoulder Girdle (Upward Rotation)', 'Wrist (Ulna Deviation)', 'Elbows (Extension)', 'Shoulder (Internal Rotation)', 'Wrist (Extension)', 'Forearm (Supination)', 'Shoulder (Extension)']",[]
31,Jump Rope: Alternating Hop Side Swing,[],[],[],Grasp jump rope handles on each side. Initiate side swing alternating side to side.,"['Hop onto one leg, same side as swing. Hop on other leg, same side swing. Continue jump and swing pattern hopping side to side.']",Intensity can be altered by increasing speed of pattern.,"['Hip (Adduction)', 'Hip (Extension)', 'Hip (Flexion)', 'Spine (Thoracic, Lumbar) (Lateral Flexion)', 'Hip (Abduction)', 'Knee (Extension)', 'Ankle (Plantar Flexion)', 'Spine (Thoracic, Lumbar) (Rotation)']",[]
32,Jump Rope: Twister,[],[],[],"Grasp jump rope handles on each side. Initiate side swing mount or start with rope behind body and swing rope from behind overhead. Bodyweight should be balanced on the balls of the feet, with knees slightly bent.","[""Swing rope in front of body, down to floor. Hop as rope travels under feet. Repeat hops while progressively turning lower body so feet and knees are pointed to one side while upper body's orientation remains unchanged throughout movement. Rotate lower body so feet and knees are pointing to opposited side. Continue hoping over rope while progressively rotating lower body from side to side.""]","Hop heights should be minimal, just enough to clear the rope, maximize jump rope efficiency, and decrease joint impact. Intensity can be altered by increasing speed of hops. Force (Articulation)","['Hip (Extension)', 'Knee (Extension)', 'Ankle (Plantar Flexion)']",[]
33,Jump Rope: Toe Tap,[],[],[],"Grasp jump rope handles on each side. Initiate side swing mount or start with rope behind body and swing rope from behind overhead. Swing rope in front of body, down to floor.",[],"Hop heights should be minimal, just enough to clear rope, maximize jump rope efficiency, and decrease joint impact. Intensity can be altered by increasing speed of hops.","['Ankle (Plantar Flexion)', 'Hip (Extension)', 'Knee (Extension)', 'Hip (Flexion)']",['Hip (Abduction)']
34,Swim: Back Stroke,[],[],[],Float on back looking up with arms extended down sides of body. Keep legs extended with toes pointed.,"['Kick legs up and down in alternating flutter motion while keeping feet extended. With arms straight, raise arm up out of water and back behind shoulder. Arm enters water with pinky side of hand entering first. Other arm exits to perform backwards arc motion. Submerged arm should powerfully pull through water down to side with hand slightly cupped. Submerged arm bends and straightening until reaching side of thigh before exiting water. Continue alternating rotation of arms while continuing to kick legs.', 'Keep head in neutral position, facing ceiling as body rotates from side to side. Although shoulders and hips rotate together, shoulders rotate further thereby producing spinal lumbar rotation. Pull in abdomen to flatten back while eliminating arching. Knees are kept under water with toes making small splash during flutter while emphasizing powerful hip musculature for added propulsion. Arms submerge in circle motion under the water to propel body backwards. With elbow positioned high, initiate pull phase of stroke by pressing downwards with forearm before pulling out from side of body. Breathe as needed since face is out of water. At least one breath should be taken per stroke, typically inhaling during one arm arc and exhaling during other arm arc.', 'Primary movements significantly contributing to propulsion include bolded Force Articulations. Other movements are either secondary movers contributing to propulsion or repositioning of body for propulsive movements. Shoulder Flexion contributes to propulsion only in its initial phase before arm moves under water.']","Keep head in neutral position, facing ceiling as body rotates from side to side. Although shoulders and hips rotate together, shoulders rotate further thereby producing spinal lumbar rotation. Pull in abdomen to flatten back while eliminating arching. Knees are kept under water with toes making small splash during flutter while emphasizing powerful hip musculature for added propulsion. Arms submerge in circle motion under the water to propel body backwards. With elbow positioned high, initiate pull phase of stroke by pressing downwards with forearm before pulling out from side of body. Breathe as needed since face is out of water. At least one breath should be taken per stroke, typically inhaling during one arm arc and exhaling during other arm arc.","['Shoulder (Flexion (see comments))', 'Hip (Extension)', 'Scapula & Clavicle (Protraction)', 'Shoulder (Adduction)', 'Scapula & Clavicle (Upward Rotation)', 'Ankle (Plantar Flexion)', 'Knee (Extension)', 'Ankle (Dorsiflexion)', 'Scapula & Clavicle (Retraction)', 'Hip (Flexion)', 'Elbow (Flexion)', 'Knee (Flexion)', 'Elbow (Extension)', 'Shoulder (Abduction)', 'Spine (Cervical) (Rotation)', 'Neck (Rotation)', 'Forearm (Pronation)', 'Shoulder (Transverse Abduction)', 'Spine (Lumbar) (Rotation)', 'Scapula & Clavicle (Downward Rotation)', 'Forearm (Supination)']","['Spine (Thoracic, Lumbar) (Lateral Flexion)', 'Spine (Thoracic, Lumbar) (Extension)', 'Spine (Thoracic, Lumbar) (Flexion)', 'Wrist (Flexion)', 'Wrist (Radial Deviation)', 'Wrist (Extension)', 'Fingers (Flexion)', 'Fingers (Extension)']"
35,Swim: Breast Stroke,[],[],[],Float facing prone in the water with body extended. Extend arms forward with hands downward and together. Position face forward yet slightly downwards.,"['Turn thumbs downward, round hands, and pull straight arms apart and out to sides. Before elbows pass each side of shoulders, pull arms downward and inward by flexing elbows and internally rotating shoulders (ie: elbows kept high). Quickly raise head out of water by arching spine while pulling elbows to sides of body and hands together under chest. Inhale and pull abdomen in while keeping back straight and hips as close to surface of water. With palms facing together and elbow tucked in, push arms forward and fully flex knees while allowing hips to flex and slightly abduct. Lower head into water and kick backwards with feet angled outwards and backwards. Extend body and pull legs together and point feet. Exhale on the recovery phase and repeat.', 'Sequence of phases include: 1) pull, 2) breath, 3) kick, and 4) glide. During kick, push water backwards with soles of feet to propel body forward. Ankle circle during kick occurs through knee internal rotation and ankles plantar flexion. Slowest part of stroke is pulling head in and out of water since it produces no forward propulsion, therefore it should be performed as quickly as possible, only as long as it takes to inhale. To reduce drag and keep streamlined, practice quick leg movement and attempt to keep hips high throughout stroke even when pulling head out of water. That will require powerful leg muscles, flexible spine, conditioned erector spinae, and flexible hip flexors.', 'Primary movements significantly contributing to propulsion include bolded Force Articulations. Other movements are either secondary movers contributing to propulsion or repositioning of body for propulsive movements.']",,"['Hip (Extension)', 'Shoulder (Flexion)', 'Spine (Cervical) (Flexion)', 'Neck (Hyperextension)', 'Shoulder (Adduction)', 'Scapula & Clavicle (Upward Rotation)', 'Knee (Extension)', 'Ankle (Plantar Flexion)', 'Spine (Cervical) (Hyperextension)', 'Spine (Thoracic, Lumbar) (Hyperextension)', 'Ankle (Dorsiflexion)', 'Scapula & Clavicle (Retraction)', 'Fingers (Flexion)', 'Hip (Flexion)', 'Elbow (Flexion)', 'Knee (Flexion)', 'Neck (Flexion)', 'Hip (Abduction)', 'Elbow (Extension)', 'Shoulder (Abduction)', 'Shoulder (Internal Rotation)', 'Wrist (Extension / Hyperextension)', 'Fingers (Extension)', 'Shoulder (Extension)', 'Foot (Plantar Flexion)', 'Hip (Adduction)', 'Wrist (Flexion)', 'Wrist (Radial Deviation)', 'Shoulder (Transverse Adduction)', 'Knee (Internal Rotation)', 'Foot (Inversion)', 'Forearm (Pronation)', 'Spine (Thoracic, Lumbar) (Flexion)', 'Foot (Eversion)', 'Scapula & Clavicle (Downward Rotation)', 'Forearm (Supination)', 'Knee (External Rotation)']",[]
36,Swim: Butterfly,[],[],[],Float prone with body extended in the water facing downward to bottom of pool. Position straight arms forward with one hand place on other. Initiate dolphin kick by driving from hip kicking down until hip reach full extension. Kick quickly down with feet pointed and ankles flicking at end. Kick up by relaxing hips and bring heels to surface of water by slightly bending knee.,"['While moving body in fluid wave motion, simultaneously raise straight arms from sides out of water and move arms forward just above water line. Lower straight arms to each side of head into water while repositioning head 90° downward. Scoop water with outward facing hands and elbows positioned high. Pull arms underneath body, pushing body forward, and extending them through to hips. Accelerate arms up and out of water from sides of hip and repeat stroke.', 'Two kicks should be performed during each arm cycle, one at start of arm pull and one towards end of arm pull. Keeping feet under surface of water. Enter hands into water slightly wider than shoulder width (11 and 1 o’clock). Elbow bends slightly as they pass under body. As needed, push down on water through stroke and lift head out of water and inhale, keeping chin close to waterline. Butterfly technique is considered more difficult than any other stroke due to it being a short axis stroke, requiring greater strength and endurance. It also requires greater coordination and timing that other strokes.']","Two kicks should be performed during each arm cycle, one at start of arm pull and one towards end of arm pull. Keeping feet under surface of water. Enter hands into water slightly wider than shoulder width (11 and 1 o’clock). Elbow bends slightly as they pass under body. As needed, push down on water through stroke and lift head out of water and inhale, keeping chin close to waterline. Butterfly technique is considered more difficult than any other stroke due to it being a short axis stroke, requiring greater strength and endurance. It also requires greater coordination and timing that other strokes.","['Hip (Extension)', 'Scapula & Clavicle (Depression)', 'Spine (Cervical) (Flexion)', 'Scapula & Clavicle (Protraction)', 'Shoulder (Adduction)', 'Scapula & Clavicle (Upward Rotation)', 'Ankle (Plantar Flexion)', 'Knee (Extension)', 'Spine (Cervical) (Hyperextension)', 'Forearm (Pronation)', 'Spine (Thoracic, Lumbar) (Hyperextension)', 'Ankle (Dorsiflexion)', 'Scapula & Clavicle (Retraction)', 'Scapula & Clavicle (Elevation)', 'Hip (Flexion)', 'Elbow (Flexion)', 'Knee (Flexion)', 'Neck (Flexion)', 'Spine (Thoracic, Lumbar) (Flexion)', 'Elbow (Extension)', 'Shoulder (Abduction)', 'Neck (Extension / Hyperextension)', 'Scapula & Clavicle (Downward Rotation)', 'Forearm (Supination)', 'Shoulder (Extension)']","['Wrist (Flexion)', 'Wrist (Radial Deviation)', 'Fingers (Flexion)']"
37,Swim: Freestyle,[],[],[],"Float prone with body extended in the water facing downward to bottom of pool. Extend right arm straight forward with palm downward and elbow pointed to side. Position left arm extended back to side. Kick in alternating pattern with legs fairly straight. Kick forcefully from hip while straightening leg as extended foot moves downward. As foot returns upwards, allow knee to bend slightly and ankle to bend slightly.","['Rotate torso leftward away from right forward extended arm while raising left extended arm to side out of water allowing it to bend slightly as it exits water. As left arm is raised out of water, turn head to left side so head is facing side of pool with mouth out of water. Inhale through mouth under left arm while moving it forward overhead. Return head to face bottom of pull as soon as possible and slowly breath out through nose or mouth. Continue reaching forward with left arm and position palms downward with wrists slightly higher than finger tips and bent elbow higher than wrist. Just before torso rotates to neutral downward position, pull right arm downward underneath body, with fingers cupped and extended in same direction while keeping right elbow pointed outward. Gently place left hand into water, placing finger tips first. Keep left elbow high as arm enters water. With left arm pointing forward and elbow pointing outward, lift right extended arm out of water from side of body. Continue extending right arm to side, pushing backwards. Repeat stroke with opposite sides, alternating between sides.']",One kick should be completed per arm cycle. Keep ankles slightly relaxed to assist in propulsion. Kick hard on down-kick and more relaxed on up-kick.,"['Hip (Extension)', 'Scapula & Clavicle (Depression)', 'Scapula & Clavicle (Protraction)', 'Shoulder (Adduction)', 'Scapula & Clavicle (Upward Rotation)', 'Ankle (Plantar Flexion)', 'Knee (Extension)', 'Ankle (Dorsiflexion)', 'Scapula & Clavicle (Retraction)', 'Scapula & Clavicle (Elevation)', 'Hip (Flexion)', 'Elbow (Flexion)', 'Knee (Flexion)', 'Elbow (Extension)', 'Shoulder (Abduction)', 'Shoulder (Extension)', 'Spine (Cervical) (Rotation)', 'Neck (Rotation)', 'Spine (Thoracic, Lumbar) (Rotation)', 'Forearm (Pronation)', 'Scapula & Clavicle (Downward Rotation)', 'Forearm (Supination)']","['Spine (Thoracic, Lumbar) (Extension / Hyperextension)', 'Spine (Thoracic, Lumbar) (Flexion)', 'Spine (Cervical) (Extension / Hyperextension)', 'Neck (Extension / Hyperextension)', 'Wrist (Flexion)', 'Wrist (Radial Deviation)', 'Fingers (Flexion)']"
38,Climb Mill / Tread Wall,[],[],[],Face wall. Grasp handholds above head and position feet on lower holds.,"['Climb wall by continuously grasping higher handholds and positioning feet onto higher holds below.', ""Step down when finished. Apparatus shown uses bodyweight with sensors to move wall downward as participant climbs. Speeds of wall's descent can be preset but it also adjusts to participant's speed. Turn of wheel changes angle of wall from easy slope to severe overhang. Although many more articulations are used in climbing, only most commonly used movements to raise body weight (eg: hip extension) or larger body segments (eg: hip flexion) are listed.""]","Step down when finished. Apparatus shown uses bodyweight with sensors to move wall downward as participant climbs. Speeds of wall's descent can be preset but it also adjusts to participant's speed. Turn of wheel changes angle of wall from easy slope to severe overhang. Although many more articulations are used in climbing, only most commonly used movements to raise body weight (eg: hip extension) or larger body segments (eg: hip flexion) are listed.","['Hip (Adduction)', 'Hip (Extension)', 'Finger (Flexion)', 'Hip (Flexion)', 'Shoulder (Adduction)', 'Elbow (Flexion)', 'Spine (Lateral Flexion)', 'Knee (Extension)', 'Hip (Abduction)', 'Ankle (Plantar Flexion)', 'Elbow (Extension)', 'Scapula & Clavicle (Downward Rotation)', 'Spine (Flexion)', 'Shoulder (Extension)']",[]
39,Climber,[],[],[],"Hold handlebars. Step one foot on lower foot pedal, and one foot on higher foot pedal, making both feet level with each other. Adjust handles to chin height. Turn machine on.","['Push one foot pedal down and pull down same-side handlebar, allowing opposite foot pedal and handlebar to rise. Alternate movement on opposite side and repeat.']","On models with variable resistance (LX, SM, CM, SRM, TS), adjust to Step Faster before beginning. If the seat is used the exercise would be non-weight bearing. Low level cardiac patients with a 2 MET level functional capacity can begin exercising on Climber by pedaling in seated position (optional on models LX, SM, SRM, TS).","['Hip (Extension)', 'Shoulder (Flexion)', 'Hip (Flexion)', 'Elbow (Flexion)', 'Scapula & Clavicle (Upward Rotation)', 'Ankle (Plantar Flexion)', 'Knee (Extension)', 'Elbow (Extension)', 'Scapula & Clavicle (Downward Rotation)', 'Shoulder (Extension)']","['Hip (Abduction)', 'Spine (Lateral Flexion)']"
