,excercise_name,utility,mechanics,force,preparation,execution,comments,dynamic_articulation,static_articulation
40,Ladder Mill (Jacob's Ladder),[],[],[],Secure belt cable attachment around waist with cable in back. Climb onto ladder by stepping onto rung near bottom and grasp rung closer to middle top.,"['Climb ladder by stepping up and grasping one rung at a time.', ""Intensity can be increased by climbing faster, or higher on ladder since greater cable tension permits rungs to travel downward at greater speed. A weighted vest can also be worn to increase difficulty. To come to a stop, climb more slowly lower down on rungs, then step down onto ground. Also known as Jacob's Ladder.""]","Intensity can be increased by climbing faster, or higher on ladder since greater cable tension permits rungs to travel downward at greater speed. A weighted vest can also be worn to increase difficulty. To come to a stop, climb more slowly lower down on rungs, then step down onto ground. Also known as Jacob's Ladder.","['Hip (Extension)', 'Shoulder (Flexion)', 'Hip (Flexion)', 'Scapula & Clavicle (Upward Rotation)', 'Ankle (Plantar Flexion)', 'Knee (Extension)', 'Scapula & Clavicle (Downward Rotation)', 'Shoulder (Extension)']","['Hip (Transverse Abduction)', 'Spine (Lateral Flexion)', 'Shoulder (Transverse Flexion)', 'Elbow (Extension)']"
41,Bicycling,[],[],[],,"['Continue to push pedal with foot (power foot) by extending hip and knee to propel bike forward while opposite foot (recovery foot) maintains contact with other pedal. Once the recovery foot is in position, push pedal with opposite foot to continue cycle. Repeat this sequence of power and recovery alternating between sides to keep the bike in motion while maintaining balance. ']",Adjust seat so knees are just short of full extension.,"['Hip (Extension)', 'Knee (Extension)']",['Ankle (Plantar Flexion)']
42,Cycle Cross-Trainer,[],[],[],"Sit on seat with feet on pedals and grasp handle bars. Select ""start"".",['Pedal while alternating handle bars back and forth.'],Adjust seat so knees are short of full extension. Intensity can be altered by resistance and speed (revolutions per minute).,"['Hip (Extension)', 'Shoulder (Flexion)', 'Scapula & Clavicle (Retraction)', 'Scapula & Clavicle (Protraction)', 'Elbow (Flexion)', 'Knee (Extension)', 'Elbow (Extension)', 'Shoulder (Extension)']",['Ankle (Plantar Flexion)']
43,Cycle Ergometer,[],[],[],,['Pedal.'],Adjust seat so knees are just short of full extension. Intensity can be altered by resistance and speed (revolutions per minute).,"['Hip (Extension)', 'Knee (Extension)']",['Ankle (Plantar Flexion)']
44,Recumbent Cycle,[],[],[],"Sit on seat and grasp handlebars on sides. Place feet on pedals. Select ""quick start"" or enter program.",['Pedal.'],Adjust seat so knees are short of full extension. Intensity can be altered by resistance and speed (revolutions per minute).,"['Hip (Extension)', 'Knee (Extension)']",['Ankle (Plantar Flexion)']
45,Recumbent Cycle Cross Trainer,[],[],[],"Sit on seat with feet on pedals and grasp handlebars. Select ""start"".",['Pedal while alternating handlebars back and forth.'],Adjust seat so knees are short of full extension. Intensity can be altered by resistance and speed (revolutions per minute).,"['Hip (Extension)', 'Shoulder (Flexion)', 'Scapula & Clavicle (Retraction)', 'Scapula & Clavicle (Protraction)', 'Elbow (Flexion)', 'Knee (Extension)', 'Elbow (Extension)', 'Shoulder (Extension)']",['Ankle (Plantar Flexion)']
46,Recumbent Upright Cycle,[],[],[],"Sit on seat and grasp handlebars on sides. Place feet on pedals. Select ""quick start"" or enter program.",['Pedal.'],Adjust seat so knees are short of full extension. Intensity can be altered by resistance and speed (revolutions per minute). Apparatus is between an upright and recumbent cycle.,"['Hip (Extension)', 'Knee (Extension)']",['Ankle (Plantar Flexion)']
47,Elliptical Cross-Trainer,[],[],[],"Step on pedal platforms and grasp handlebars on each arm lever. Select ""quick start"" or enter program.",['Pedal forward while alternating the arm levers back and forth.'],Pedaling backward can be performed for variety or for active recovery. Intensity can be altered by resistance/speed (strides per minute). Lower resistance allows for greater speed which increases exercise intensity. Also see Elliptical Trainer.,"['Hip (Extension)', 'Shoulder (Flexion)', 'Scapula & Clavicle (Retraction)', 'Scapula & Clavicle (Protraction)', 'Elbow (Flexion)', 'Knee (Extension)', 'Elbow (Extension)', 'Shoulder (Extension)']","['Hip (Abduction)', 'Spine (Lateral Flexion)']"
48,Elliptical Glider,[],[],[],"Step on pedal platforms and grasp handle rails. Select ""quick start"" or enter program.",['Pedal forward by placing weight on one foot while allowing the other foot to move forward on opposite pedal. Alternate with opposite side until momentum allows continued forward rotation.'],Avoid transferring body weight onto handle bars. Pedaling backwards can be performed for variety or for active recovery. Intensity can be altered by resistance/speed (strides per minute). Lower resistance allows for greater speed which increases exercise intensity. Also see Elliptical Trainer.,"['Hip (Extension)', 'Knee (Extension)']","['Hip (Abduction)', 'Spine (Lateral Flexion)']"
49,Elliptical Trainer,[],[],[],"Step on pedal platforms and grasp handle rails. Select ""quick start"" or enter program.","['Pedal forward by placing weight on one foot, allowing the other foot to move forward. Alternate with opposite side until momentum allows continued forward rotation.']",Avoid transferring body weight onto handle bars. Pedaling backwards can be performed for variety or for active recovery. Adjustments to the incline shift emphasis to certain muscle groups displayed on console. Intensity can be altered by resistance/speed (strides per minute). Lower resistance allows for greater speed which increases exercise intensity. Also see Elliptical Glider.,"['Hip (Extension)', 'Knee (Extension)']","['Hip (Abduction)', 'Spine (Lateral Flexion)']"
50,Recumbent Elliptical Cross Trainer,[],[],[],"Sit on seat, place feet on pedal platforms and grasp lever bars.","['Push left foot lever forward allowing right foot lever rotate back while pulling left handle and pushing right handle. Move in opposite pattern so pedals continues to rotate forward, alternating movement between sides.']",Adjust seat so knees are short of full extension. Adjust length lever bars to allow elbow to extend yet opposite arm to remain just in front of the body. Intensity can be altered by resistance and speed (steps per minute).,"['Hip (Extension)', 'Shoulder (Flexion)', 'Scapula & Clavicle (Retraction)', 'Scapula & Clavicle (Protraction)', 'Elbow (Flexion)', 'Knee (Extension)', 'Elbow (Extension)', 'Shoulder (Extension)']",[]
51,Kayak Machine,[],[],[],"Sit on seat with handlebar shaft between legs and feet on angled platforms to each side. Select resistance and push ""quick start"" or enter program. Grasp handlebars with a comfortably wide grip and bring them to an upright position.","[""Pull down and back with left arm while pushing up and forward with right arm, across body's centerline. Complete stroke by pull-down and back with right arm while pushing up and forward with left arm, across body's centerline.""]","Maintain relatively erect posture throughout session. Increase rate of stroke if weight stack approaches lower position. Likewise, decrease rate of stroke if weight stack approaches upper position. Intensity can be altered by resistance and rate of stroke (strokes per minute). To adjust resistance select resistance on weight stack. As alternative exercise, Push-pull movement can also be performed on apparatus. Make and model shown is Stairmaster Crossrobics 2650 UE.","['Scapula & Clavicle (Retraction)', 'Shoulder (Flexion)', 'Scapula & Clavicle (Protraction)', 'Spine (Rotation)', 'Shoulder (Transverse Abduction)', 'Elbow (Flexion)', 'Elbow (Extension)', 'Shoulder (Transverse Adduction)', 'Shoulder (Extension)']",[]
52,Rider,[],[],[],Sit on seat. Place feet on pedals and grasp handlebars.,['Extend hips and knees while pulling handlebars back to sides. Return to original position and repeat.'],"Keep chest high, particularly at end of pulling phase (top position). Rider movement borders on weight-bearing at top of movement (legs extended). Intensity can be altered by lever adjustment and speed (strokes per minute).","['Hip (Extension)', 'Scapula & Clavicle (Retraction)', 'Elbow (Flexion)', 'Knee (Extension)', 'Ankle (Plantar Flexion)', 'Shoulder (Extension)']",['Spine (Extension)']
53,Row Ergometer,[],[],[],"Sit on seat. Position and secure feet on platform. Grasp handlebar with both hands, overhand grip. With legs extended, pull handlebar to midsection, forearms horizontal.",[],Make sure handlebar is anchored on hook within reach before feet are strapped. Intensity can be altered by damper setting and speed (strokes per minute). Faster wheel spins creates greater wind resistance on fan blades. Damper setting is like gears on a bicycle.,"['Hip (Extension)', 'Scapula & Clavicle (Retraction)', 'Elbow (Flexion)', 'Knee (Extension)', 'Ankle (Plantar Flexion)', 'Shoulder (Extension)']",['Spine (Extension)']
54,Row Ergometer (canoe stroke),[],[],[],"Sit on seat. Position and secure feet on platform. Grasp handlebar with mixed grip, overhand grip on one side and underhand grip on side. With legs extended, pull handlebar to midsection.",[],Make sure handlebar is anchored on hook within reach before feet are strapped. Intensity can be altered by damper setting and speed (strokes per minute). Faster wheel spins creates greater wind resistance on fan blades. Damper setting is like gears on a bicycle.,"['Hip (Extension)', 'Scapula & Clavicle (Retraction)', 'Elbow (Flexion)', 'Knee (Extension)', 'Ankle (Plantar Flexion)', 'Shoulder (Extension)']",['Spine (Extension)']
55,Ski Machine (cords),[],[],[],Step on pedal platforms and grasp a rope grip in each hand.,"['Kick and glide pedal platforms back and forth while swinging arms along sides. Swing arms so constant tension is maintained on arm swinging down, extending forward arm as\nfar as is comfortable.']","When familiarizing yourself with this movement, practice the lower and upper movements separately. Intensity can be altered by resistance and speed (strides per minute). To increase flywheel or arm tension, turn respective knobs clockwise.","['Hip (Extension)', 'Shoulder (Flexion)', 'Scapula & Clavicle (Retraction)', 'Scapula & Clavicle (Protraction)', 'Spine (Rotation)', 'Hip (Flexion)', 'Shoulder (Extension)']","['Knee (Extension)', 'Hip (Abduction)', 'Spine (Lateral Flexion)', 'Ankle (Plantar Flexion)', 'Elbow (Extension)']"
56,Ski Machine (rails),[],[],[],Step on pedal platforms and grasp sliding grips on rails in each hand.,"['Kick and glide pedal platforms back and forth while sliding grips along rails back and forth as far as possible.', 'When familiarizing yourself with this movement, practice the lower and upper movements separately. Intensity can be altered by resistance and speed (strides per minute). To increase flywheel resistance, turn knob clockwise.']","When familiarizing yourself with this movement, practice the lower and upper movements separately. Intensity can be altered by resistance and speed (strides per minute). To increase flywheel resistance, turn knob clockwise.","['Hip (Extension)', 'Shoulder (Flexion)', 'Scapula & Clavicle (Retraction)', 'Scapula & Clavicle (Protraction)', 'Spine (Rotation)', 'Hip (Flexion)', 'Shoulder (Extension)']","['Knee (Extension)', 'Hip (Abduction)', 'Spine (Lateral Flexion)', 'Ankle (Plantar Flexion)']"
57,Ski Ergometer,[],[],[],"Place wrists through straps, up through undersides of loops, then grasp handles with each hand. Stand with shoulder width stance with bent arms in front and hands slightly above head.","['Pull both cable handles downward by extending shoulders, flexing spine, and bending legs. Extend arms downward and slightly back at bottom of stroke. Return to original position by extending body and arms upward. Repeat.']",Machine simulates nordic skiing. Heels can come off ground at top of motion. Staggered stance places more emphasis on obliques. Intensity can be altered by damper setting and speed (strokes per minute). Faster wheel spins creates greater wind resistance on fan blades. Damper setting is like gears on a bicycle. Choose a damper setting that is most comfortable. Skiing with damper setting too high will reduce your output and may increase risk of injury. Watch display for power output or speed.,"['Hip (Extension)', 'Scapula & Clavicle (Retraction)', 'Spine (Extension)', 'Hip (Flexion)', 'Ankle (Plantar Flexion)', 'Knee (Extension)', 'Elbow (Extension)', 'Scapula & Clavicle (Downward Rotation)', 'Spine (Flexion)', 'Shoulder (Extension)']",[]
58,Recumbent Stepper,[],[],[],"Select resistance and push ""quick start"" or enter program. Lay back on incline with hips between handlebars. Grasps handlebars on sides and place feet on pedal platforms. Push both foot levers down by extending legs to raise weight stack. Allow one foot lever to raise up by bending hip and knee of one leg.","['Push foot lever back down while simultaneously allowing opposite foot lever to raise up, alternating foot levers up and down.']","Increase rate of stepping if weight stack approaches lower position. Likewise, decrease rate of stepping if weight stack approaches upper position. Intensity can be altered by resistance and rate of stepping (steps per minute). To adjust resistance select resistance on weight stack. Make and model shown is Stairmaster Crossrobics 1650 LE.","['Hip (Extension)', 'Knee (Extension)']",[]
59,Recumbent Stepper Cross Trainer,[],[],[],"Sit on seat, place feet on pedal platforms and grasp lever bars.",['Push left foot lever down allowing right foot lever to raise up while pulling left handle and pushing right handle. Move in opposite pattern and continue alternating between sides.'],The seat swivels and the armrest lifts up to allow easier access. Adjust seat so knees are short of full extension. Adjust length lever bars to allow elbow to extend yet opposite arm to remain just in front of the body. Intensity can be altered by resistance and speed (steps per minute). To increase resistance push lever forward and down. To decrease resistance pull lever backward and up.,"['Hip (Extension)', 'Shoulder (Flexion)', 'Scapula & Clavicle (Retraction)', 'Scapula & Clavicle (Protraction)', 'Elbow (Flexion)', 'Knee (Extension)', 'Elbow (Extension)', 'Shoulder (Extension)']",[]
60,Stair Climber,[],[],[],"Step onto pedal platforms and grasp handrails. Select ""quick start"" or enter program.","['Place weight on one pedal and allow other pedal to raise. Before lower lever hits bottom or upper lever hits top, alternate with opposite movement. Repeat.']",Avoid transferring body weight onto handlebars. Intensity can be altered by increasing speed (steps per minute). Also see Stepmill.,"['Hip (Extension)', 'Knee (Extension)', 'Ankle (Plantar Flexion)']","['Hip (Abduction)', 'Spine (Lateral Flexion)']"
61,Stepmill,[],[],[],"Step onto stairs and grasp hand rails. Select ""quick start"" or enter program.",['Climb stairs to keep pace with machine.'],Avoid transferring body weight onto handle bars. Intensity can be altered by increasing speed (steps per minute). Also see Lever Stair Climber.,"['Hip (Extension)', 'Hip (Flexion)', 'Knee (Extension)', 'Ankle (Plantar Flexion)', 'Foot (Plantar Flexion)']","['Hip (Abduction)', 'Spine (Lateral Flexion)']"
62,Tread Climber,[],[],[],"Step onto deck of tread climber and grasp rails. Attach safety tether. Select ""quick start"" or enter program.","['Step onto walking belt of upper treadle and allow foot to travel toward back of machine as it lowers. As other treadle rises, swing opposite leg forward and step onto its belt. Again, allow foot travel to back of machine as treadle lowers. Repeat walking pattern, keeping pace with machine.']","Hands can be placed lightly on rails for balance. Avoid transferring body weight or 'hanging' onto handlebars. Maintain close distance from console stepping forward on each treadle. Intensity can be altered by treadle travel and speed (mph or kmph). Cylinders can be adjusted so treadles depress easier or harder according to body weight and desired intensity. Also stepping nearer front of treadles allows them to depress downward more freely. Treadles should not bottom out. Adjusting hydraulic cylinder dial closer to maximum settings permits greater treadle travel resulting in more intense workout. Adjust dial toward minimum setting until achieving comfortable amount of travel, displace enough to absorb the impact of stepping motion, approximately 3 inches.","['Hip (Extension)', 'Hip (Flexion)', 'Knee (Extension)', 'Ankle (Plantar Flexion)', 'Foot (Plantar Flexion)']","['Hip (Abduction)', 'Spine (Lateral Flexion)', 'Ankle (eccentric) (Dorsal Flexion)']"
63,Treadmill Run,[],[],[],"Step onto deck of treadmill and grasp rails. Straddle belt by standing on sides of treadmill. Attach safety tether. Select ""quick start"" or enter program.","['Run, keeping pace with treadmill.', ""Maintain close distance from console. Hand can be placed on rail to regain balance. Avoid transferring body weight or 'hanging' onto handlebars. Intensity can be altered by incline and speed (mph or kmph).""]",Maintain close distance from console. Hand can be placed on rail to regain balance. Avoid transferring body weight or 'hanging' onto handlebars. Intensity can be altered by incline and speed (mph or kmph).,"['Scapula (Upward Rotation)', 'Hip (Extension)', 'Shoulder (Flexion)', 'Spine (Rotation)', 'Hip (Flexion)', 'Shoulder (Extension / Hyperextension)', 'Ankle (Plantar Flexion)', 'Knee (Extension)', 'Foot (Plantar Flexion)', 'Scapula (Downward Rotation)']","['Hip (Abduction)', 'Spine (Lateral Flexion)', 'Ankle (eccentric) (Dorsal Flexion)']"
64,Treadmill Walk,[],[],[],"Step onto deck of treadmill and grasp rails. Straddle belt by standing on sides of treadmill. Attach safety tether. Select ""quick start"" or enter program.","['Walk, keeping pace with treadmill.', ""Maintain close distance from console. Hand can be placed on rail for balance. Avoid transferring body weight or 'hanging' onto handlebars. Intensity can be altered by incline and speed (mph or kmph). Spinal rotation occurs during brisk walking.""]",Maintain close distance from console. Hand can be placed on rail for balance. Avoid transferring body weight or 'hanging' onto handlebars. Intensity can be altered by incline and speed (mph or kmph). Spinal rotation occurs during brisk walking.,"['Hip (Extension)', 'Hip (Flexion)', 'Knee (Extension)', 'Ankle (Plantar Flexion)', 'Spine (brisk walking) (Rotation)', 'Foot (Plantar Flexion)']","['Hip (Abduction)', 'Spine (Lateral Flexion)', 'Ankle (eccentric) (Dorsal Flexion)']"
65,Treadmill Walk (workstation),[],[],[],Step onto deck of treadmill. Place forearms on padded edge of desk so fingers can be comfortably placed on computer keys. Start treadmill from computer.,['Walk on treadmill at comfortable pace allowing for adequate concentration on computer work.'],Avoid leaning on desk. Intensity can be altered by incline and speed (mph or kmph).,"['Hip (Extension)', 'Hip (Flexion)', 'Knee (Extension)', 'Ankle (Plantar Flexion)', 'Spine (brisk walking) (Rotation)', 'Foot (Plantar Flexion)']","['Hip (Abduction)', 'Spine (Lateral Flexion)', 'Ankle (eccentric) (Dorsal Flexion)']"
66,Arm Ergometer,[],[],[],"Sit on seat and grasp handle bars. Select ""quick start"" or enter program.",['Revolve arm crank.'],"Adjust height of arm crank shaft to shoulder height. Adjust length of crank to allow elbow to extend, yet opposite arm to remain just in front of body. Intensity can be altered by resistance and speed (revolutions per minute).","['Scapula & Clavicle (Retraction)', 'Shoulder (Flexion)', 'Scapula & Clavicle (Protraction)', 'Elbow (Flexion)', 'Shoulder (Extension)', 'Elbow (Extension)']",[]
67,Mini Tramp,[],[],[],Stand on mini tramp.,['Jump up and land in center of mini tramp allowing knees and hips to bend. Immediately jump back up and repeat.'],Handles may be used until balance or technique problems are resolved.,"['Hip (Extension)', 'Knee (Extension)', 'Ankle (Plantar Flexion)']",[]
68,Skate Machine,[],[],[],"Place hands on bar and step into pedals. Select coarse, effort, time, and push start. Place hands on bar for support.",['Slightly bend supporting leg and hip while pushing opposite pedal off to side. Glide extended leg back and repeat opposite motion when foot returns near center. Repeat by pushing off from side to side.'],"Hands may be kept off of handlebars, either swing arms from side to side or placing hands on hips. If handles are used, avoid transferring too much bodyweight onto handlebars. Begin at higher resistance for warm-up. Intensity can be increased by decreasing resistance thereby increasing speed. Also see Wave Machine.","['Hip (Adduction)', 'Hip (Extension)', 'Hip (Abduction)', 'Knee (Extension)', 'Ankle (Plantar Flexion)', 'Hip (External Rotation)']","['Spine (Lateral Flexion)', 'Spine (Extension)']"
69,Wave Machine,[],[],[],"Step onto back platform with arms extended forward and hands on handles. Step onto first pedal platform. As pedal platform sinks to side place other foot on opposite pedal platform. Select ""quick start"" or enter program.",['Shift body weight onto highest pedal platform allowing hip and knee to straighten as it sinks outward. Simultaneously allow opposite knee and hip to flex as its pedal platform rises inward. Shift body weight to opposite side with opposite movement. Repeat.'],"Hands may be kept off of handlebars. If handles are used, avoid transferring too much body weight onto handlebars. Exercise can be performed bent over with hands-on forward base of handles to emphasize glute involvement or arms in stride with movement with no contact with handles. Begin at higher resistance for warm-up. Intensity can be increased by decreasing resistance thereby increasing speed (steps per minute). Also see Skate Machine.","['Hip (Adduction)', 'Hip (Extension)', 'Knee (Extension)', 'Hip (Abduction)', 'Ankle (Plantar Flexion)', 'Hip (External Rotation)']",['Spine (Lateral Flexion)']
